"Parameter","Value","Why it matters"
"Orbital period PbP_bPb​","2.45 h, or about 8834.53 s","Sets the compactness of the orbit and strengthens relativistic effects. link.aps+1"
"Eccentricity eee","about 0.088–0.09","The nonzero eccentricity helps measure relativistic periastron advance and orbital decay. parkes.atnf.csiro+1"
"Projected semimajor axis xAx_AxA​","1.415028603 s","A key timing parameter used in mass and gravity tests. par.nsf"
"Inclination iii","about 87°","The near-edge-on geometry enables strong Shapiro-delay measurements. parkes.atnf.csiro"
"Periastron advance ω˙\dot{\omega}ω˙","about 17°/yr","One of the classic post-Keplerian tests of GR in this system. parkes.atnf.csiro"